{
  "schema": "kk-web-appearance/1",
  "profile": "be-web/1",
  "colorSpace": "srgb",
  "materials": {
    "appearance_grass": {
      "color": "#78a45d",
      "opacity": 1,
      "roughness": 0.88,
      "metalness": 0,
      "emissive": "#000000",
      "emissiveIntensity": 0,
      "unlit": false,
      "side": "double",
      "flatShading": false
    },
    "appearance_grass_light": {
      "color": "#8db66d",
      "opacity": 1,
      "roughness": 0.88,
      "metalness": 0,
      "emissive": "#000000",
      "emissiveIntensity": 0,
      "unlit": false,
      "side": "front",
      "flatShading": false
    },
    "appearance_asphalt": {
      "color": "#344b50",
      "opacity": 1,
      "roughness": 0.79,
      "metalness": 0,
      "emissive": "#000000",
      "emissiveIntensity": 0,
      "unlit": false,
      "side": "double",
      "flatShading": false
    },
    "appearance_asphalt_warm": {
      "color": "#466368",
      "opacity": 1,
      "roughness": 0.79,
      "metalness": 0,
      "emissive": "#000000",
      "emissiveIntensity": 0,
      "unlit": false,
      "side": "front",
      "flatShading": false
    },
    "appearance_edge": {
      "color": "#f2d78d",
      "opacity": 1,
      "roughness": 0.88,
      "metalness": 0,
      "emissive": "#000000",
      "emissiveIntensity": 0,
      "unlit": false,
      "side": "double",
      "flatShading": false
    },
    "appearance_center": {
      "color": "#d9e7dc",
      "opacity": 1,
      "roughness": 0.88,
      "metalness": 0,
      "emissive": "#000000",
      "emissiveIntensity": 0,
      "unlit": false,
      "side": "double",
      "flatShading": false
    },
    "appearance_plaza": {
      "color": "#d1bd92",
      "opacity": 1,
      "roughness": 0.88,
      "metalness": 0,
      "emissive": "#000000",
      "emissiveIntensity": 0,
      "unlit": false,
      "side": "front",
      "flatShading": false
    },
    "appearance_wood": {
      "color": "#a66e43",
      "opacity": 1,
      "roughness": 0.88,
      "metalness": 0,
      "emissive": "#000000",
      "emissiveIntensity": 0,
      "unlit": false,
      "side": "front",
      "flatShading": false
    },
    "appearance_wood_dark": {
      "color": "#634a39",
      "opacity": 1,
      "roughness": 0.88,
      "metalness": 0,
      "emissive": "#000000",
      "emissiveIntensity": 0,
      "unlit": false,
      "side": "front",
      "flatShading": false
    },
    "appearance_metal": {
      "color": "#536c70",
      "opacity": 1,
      "roughness": 0.79,
      "metalness": 0,
      "emissive": "#000000",
      "emissiveIntensity": 0,
      "unlit": false,
      "side": "front",
      "flatShading": false
    },
    "appearance_trunk": {
      "color": "#786048",
      "opacity": 1,
      "roughness": 0.88,
      "metalness": 0,
      "emissive": "#000000",
      "emissiveIntensity": 0,
      "unlit": false,
      "side": "front",
      "flatShading": false
    },
    "appearance_canopy": {
      "color": "#4b8354",
      "opacity": 1,
      "roughness": 0.88,
      "metalness": 0,
      "emissive": "#000000",
      "emissiveIntensity": 0,
      "unlit": false,
      "side": "front",
      "flatShading": false
    },
    "appearance_canopy_light": {
      "color": "#74a65a",
      "opacity": 1,
      "roughness": 0.88,
      "metalness": 0,
      "emissive": "#000000",
      "emissiveIntensity": 0,
      "unlit": false,
      "side": "front",
      "flatShading": false
    },
    "appearance_shrub": {
      "color": "#66944f",
      "opacity": 1,
      "roughness": 0.88,
      "metalness": 0,
      "emissive": "#000000",
      "emissiveIntensity": 0,
      "unlit": false,
      "side": "front",
      "flatShading": false
    },
    "appearance_flower": {
      "color": "#e9a86a",
      "opacity": 1,
      "roughness": 0.88,
      "metalness": 0,
      "emissive": "#000000",
      "emissiveIntensity": 0,
      "unlit": false,
      "side": "front",
      "flatShading": false
    },
    "appearance_flower_alt": {
      "color": "#b7a7d7",
      "opacity": 1,
      "roughness": 0.88,
      "metalness": 0,
      "emissive": "#000000",
      "emissiveIntensity": 0,
      "unlit": false,
      "side": "front",
      "flatShading": false
    },
    "appearance_sign": {
      "color": "#f6edd2",
      "opacity": 1,
      "roughness": 0.88,
      "metalness": 0,
      "emissive": "#000000",
      "emissiveIntensity": 0,
      "unlit": false,
      "side": "front",
      "flatShading": false
    }
  },
  "lighting": {
    "mode": "web-default",
    "builtInScale": 1
  },
  "renderer": {
    "toneMapping": "aces-filmic",
    "exposure": 0.95,
    "outputColorSpace": "srgb",
    "background": "#eef1ed",
    "fog": {
      "near": 6,
      "far": 16,
      "color": "#eef1ed"
    }
  }
}
