{
  "schema": "kk-web-appearance/1",
  "profile": "be-web/1",
  "colorSpace": "srgb",
  "materials": {
    "appearance_ground": {
      "color": "#3d4a47",
      "opacity": 1.0,
      "roughness": 0.9,
      "metalness": 0.0,
      "emissive": "#000000",
      "emissiveIntensity": 0.0,
      "unlit": false,
      "side": "front",
      "flatShading": false
    },
    "appearance_foundation": {
      "color": "#6e7870",
      "opacity": 1.0,
      "roughness": 0.9,
      "metalness": 0.0,
      "emissive": "#000000",
      "emissiveIntensity": 0.0,
      "unlit": false,
      "side": "front",
      "flatShading": false
    },
    "appearance_ramp_0": {
      "color": "#619196",
      "opacity": 1.0,
      "roughness": 0.9,
      "metalness": 0.0,
      "emissive": "#000000",
      "emissiveIntensity": 0.0,
      "unlit": false,
      "side": "front",
      "flatShading": false
    },
    "appearance_edge_0_-0.335": {
      "color": "#f0d991",
      "opacity": 1.0,
      "roughness": 0.9,
      "metalness": 0.0,
      "emissive": "#000000",
      "emissiveIntensity": 0.0,
      "unlit": false,
      "side": "front",
      "flatShading": false
    },
    "appearance_edge_0_0.335": {
      "color": "#f0d991",
      "opacity": 1.0,
      "roughness": 0.9,
      "metalness": 0.0,
      "emissive": "#000000",
      "emissiveIntensity": 0.0,
      "unlit": false,
      "side": "front",
      "flatShading": false
    },
    "appearance_ramp_1": {
      "color": "#859e78",
      "opacity": 1.0,
      "roughness": 0.9,
      "metalness": 0.0,
      "emissive": "#000000",
      "emissiveIntensity": 0.0,
      "unlit": false,
      "side": "front",
      "flatShading": false
    },
    "appearance_edge_1_-0.335": {
      "color": "#f0d991",
      "opacity": 1.0,
      "roughness": 0.9,
      "metalness": 0.0,
      "emissive": "#000000",
      "emissiveIntensity": 0.0,
      "unlit": false,
      "side": "front",
      "flatShading": false
    },
    "appearance_edge_1_0.335": {
      "color": "#f0d991",
      "opacity": 1.0,
      "roughness": 0.9,
      "metalness": 0.0,
      "emissive": "#000000",
      "emissiveIntensity": 0.0,
      "unlit": false,
      "side": "front",
      "flatShading": false
    },
    "appearance_ramp_2": {
      "color": "#b28c5c",
      "opacity": 1.0,
      "roughness": 0.9,
      "metalness": 0.0,
      "emissive": "#000000",
      "emissiveIntensity": 0.0,
      "unlit": false,
      "side": "front",
      "flatShading": false
    },
    "appearance_edge_2_-0.335": {
      "color": "#f0d991",
      "opacity": 1.0,
      "roughness": 0.9,
      "metalness": 0.0,
      "emissive": "#000000",
      "emissiveIntensity": 0.0,
      "unlit": false,
      "side": "front",
      "flatShading": false
    },
    "appearance_edge_2_0.335": {
      "color": "#f0d991",
      "opacity": 1.0,
      "roughness": 0.9,
      "metalness": 0.0,
      "emissive": "#000000",
      "emissiveIntensity": 0.0,
      "unlit": false,
      "side": "front",
      "flatShading": false
    },
    "appearance_start_platform": {
      "color": "#878f7d",
      "opacity": 1.0,
      "roughness": 0.9,
      "metalness": 0.0,
      "emissive": "#000000",
      "emissiveIntensity": 0.0,
      "unlit": false,
      "side": "front",
      "flatShading": false
    },
    "appearance_start_paint": {
      "color": "#e6c445",
      "opacity": 1.0,
      "roughness": 0.9,
      "metalness": 0.0,
      "emissive": "#000000",
      "emissiveIntensity": 0.0,
      "unlit": false,
      "side": "front",
      "flatShading": false
    },
    "appearance_turn_1_platform": {
      "color": "#878f7d",
      "opacity": 1.0,
      "roughness": 0.9,
      "metalness": 0.0,
      "emissive": "#000000",
      "emissiveIntensity": 0.0,
      "unlit": false,
      "side": "front",
      "flatShading": false
    },
    "appearance_turn_1_paint": {
      "color": "#e6c445",
      "opacity": 1.0,
      "roughness": 0.9,
      "metalness": 0.0,
      "emissive": "#000000",
      "emissiveIntensity": 0.0,
      "unlit": false,
      "side": "front",
      "flatShading": false
    },
    "appearance_turn_2_platform": {
      "color": "#878f7d",
      "opacity": 1.0,
      "roughness": 0.9,
      "metalness": 0.0,
      "emissive": "#000000",
      "emissiveIntensity": 0.0,
      "unlit": false,
      "side": "front",
      "flatShading": false
    },
    "appearance_turn_2_paint": {
      "color": "#e6c445",
      "opacity": 1.0,
      "roughness": 0.9,
      "metalness": 0.0,
      "emissive": "#000000",
      "emissiveIntensity": 0.0,
      "unlit": false,
      "side": "front",
      "flatShading": false
    },
    "appearance_exit_platform": {
      "color": "#878f7d",
      "opacity": 1.0,
      "roughness": 0.9,
      "metalness": 0.0,
      "emissive": "#000000",
      "emissiveIntensity": 0.0,
      "unlit": false,
      "side": "front",
      "flatShading": false
    },
    "appearance_exit_paint": {
      "color": "#e6c445",
      "opacity": 1.0,
      "roughness": 0.9,
      "metalness": 0.0,
      "emissive": "#000000",
      "emissiveIntensity": 0.0,
      "unlit": false,
      "side": "front",
      "flatShading": false
    }
  },
  "lighting": {
    "mode": "web-default",
    "builtInScale": 1
  },
  "renderer": {
    "toneMapping": "aces-filmic",
    "exposure": 0.95,
    "outputColorSpace": "srgb",
    "background": "#eef1ed",
    "fog": {
      "near": 6,
      "far": 16,
      "color": "#eef1ed"
    }
  }
}
